{
  "$schema": "./copy.schema.json",
  "$comment": "The core copy (core.copy): one English title and message for every error code in errors.json, every licenseStatus and every activationResult (enums.json). Hand-written; `pnpm gen constants` validates it against copy.schema.json, refuses a key set that does not equal those three sources or a placeholder outside the closed set, and emits one generated copy module per SDK. Users read these strings: they say what happened and what to do, never a status number or a raw body. A code with no entry cannot exist (the generator refuses it); a code the SDK does not know at run time shows `fallback`, with the code. US spelling (license); the sign-in vocabulary of docs/design/SIGN-IN.md (Replace a device, another Polaris Locker account).",
  "copyVersion": 1,
  "locale": "en",
  "fallback": {
    "title": "Something went wrong",
    "message": "Something went wrong ({code}). Try again."
  },
  "codes": {
    "unauthorized": {
      "title": "Not signed in",
      "message": "This device isn't signed in, or its license is no longer valid. Sign in or activate again."
    },
    "not_found": {
      "title": "Not found",
      "message": "That wasn't found. It may have been removed."
    },
    "bad_request": {
      "title": "Request refused",
      "message": "The request wasn't valid. Update the app, then try again."
    },
    "forbidden": {
      "title": "Not allowed",
      "message": "You don't have permission to do that."
    },
    "attestation_required": {
      "title": "Device check needed",
      "message": "This needs a verified device. Let the app check this device, then try again."
    },
    "attestation_rejected": {
      "title": "Device check failed",
      "message": "This device couldn't be verified. Try again."
    },
    "attestation_unavailable": {
      "title": "Device check unavailable",
      "message": "Device verification isn't available for this app right now. Try again in a few minutes."
    },
    "rate_limited": {
      "title": "Too many attempts",
      "message": "Too many attempts. Wait a moment and try again."
    },
    "body_too_large": {
      "title": "Too large",
      "message": "That is too large to send."
    },
    "method_not_allowed": {
      "title": "Request refused",
      "message": "The request wasn't valid. Update the app, then try again."
    },
    "misconfigured": {
      "title": "Service not set up",
      "message": "This service isn't set up correctly. Contact the developer."
    },
    "registration_closed": {
      "title": "Registration closed",
      "message": "New devices can't register right now. Activate with a license key or sign in."
    },
    "value_not_representable": {
      "title": "Value not accepted",
      "message": "A value couldn't be saved. Change it and try again."
    },
    "document_not_representable": {
      "title": "Service problem",
      "message": "The service couldn't prepare your settings. Contact the developer."
    },
    "signing_unavailable": {
      "title": "Signing unavailable",
      "message": "The service can't sign a document right now. Try again in a few minutes."
    },
    "device_limit": {
      "title": "Device limit reached",
      "message": "This license is already on all its devices. Replace a device to use it here."
    },
    "key_entry_limit": {
      "title": "No key entries left",
      "message": "This key has no entries left. Add it to your account and sign in instead."
    },
    "license_disabled": {
      "title": "License disabled",
      "message": "This license has been disabled. Contact the developer."
    },
    "license_expired": {
      "title": "License expired",
      "message": "This license has expired. Renew it to continue."
    },
    "not_entitled": {
      "title": "Not included",
      "message": "Your license doesn't include this."
    },
    "version_blocked": {
      "title": "Update required",
      "message": "This version can't be used with your license. Update the app to continue."
    },
    "channel_not_allowed": {
      "title": "Channel not included",
      "message": "Your license doesn't include this channel."
    },
    "hardware_mismatch": {
      "title": "Device changed",
      "message": "This device's hardware changed. Activate again to use your license here."
    },
    "fingerprint_required": {
      "title": "Device check failed",
      "message": "This license needs a hardware fingerprint, which couldn't be read on this device."
    },
    "enroll_disabled": {
      "title": "No free license",
      "message": "This app doesn't offer a free license. Enter a license key or sign in."
    },
    "enroll_claimed": {
      "title": "Sign in to continue",
      "message": "This device's free license belongs to an account now. Sign in to use it."
    },
    "enroll_failed": {
      "title": "Couldn't get a free license",
      "message": "A free license couldn't be issued. Try again in a few minutes."
    },
    "managed_by_admin": {
      "title": "Set by your organization",
      "message": "This setting is managed by your organization and can't be changed here."
    },
    "catalog_unavailable": {
      "title": "Settings unavailable",
      "message": "Settings can't be loaded right now. Try again in a few minutes."
    },
    "license_unusable": {
      "title": "License no longer valid",
      "message": "Your license is no longer valid, so settings can't be loaded. Sign in or activate again."
    },
    "disabled": {
      "title": "Sign-in unavailable",
      "message": "Sign-in isn't turned on for this app."
    },
    "oidc_error": {
      "title": "Sign-in failed",
      "message": "Sign-in didn't finish. Try again."
    },
    "unavailable": {
      "title": "Sign-in unavailable",
      "message": "Sign-in isn't available right now. Try again in a few minutes."
    },
    "erasure_ledger_unavailable": {
      "title": "Account check unavailable",
      "message": "We couldn't confirm your account's status right now. Try again in a few minutes."
    },
    "identity_disabled": {
      "title": "Sign-in unavailable",
      "message": "Sign-in through this app is turned off. Your installs and licenses keep working."
    },
    "unknown_app": {
      "title": "Sign-in unavailable",
      "message": "Sign-in isn't available for this app."
    },
    "invalid_request": {
      "title": "Sign-in request invalid",
      "message": "The app sent a sign-in request we can't read. Try again."
    },
    "invalid_client": {
      "title": "Sign-in can't finish",
      "message": "This app's sign-in isn't set up correctly, so it stopped here to keep your account safe. Let its developer know."
    },
    "invalid_grant": {
      "title": "Sign-in no longer valid",
      "message": "That sign-in has expired or was already used. Sign in again."
    },
    "unsupported_grant_type": {
      "title": "Sign-in request invalid",
      "message": "The app asked for a sign-in type we don't support. Contact its developer."
    },
    "invalid_scope": {
      "title": "Access not available",
      "message": "The app asked for access this sign-in doesn't offer. Contact its developer."
    },
    "redirect_uri_mismatch": {
      "title": "Sign-in can't return to the app",
      "message": "This app's sign-in isn't set up correctly, so it stopped here to keep your account safe. Let its developer know."
    },
    "license_choice_required": {
      "title": "Choose a license",
      "message": "Choose which license this device uses, then continue."
    },
    "auth_method_disabled": {
      "title": "Sign-in method unavailable",
      "message": "That sign-in method is turned off. Choose another one."
    },
    "email_unavailable": {
      "title": "Email sign-in unavailable",
      "message": "Email sign-in isn't available right now. Choose another sign-in method."
    },
    "turnstile_failed": {
      "title": "Check didn't pass",
      "message": "The security check didn't pass. Reload the page and try again."
    },
    "signin_expired": {
      "title": "Sign-in expired",
      "message": "This sign-in has expired. Start again."
    },
    "invalid_code": {
      "title": "Wrong code",
      "message": "That code isn't right. Check the email and try again."
    },
    "code_expired": {
      "title": "Code expired",
      "message": "That code has expired. Send a new code."
    },
    "email_in_use": {
      "title": "Email already in use",
      "message": "Another Polaris Locker account already uses this email. Join this sign-in to that account, or use a different email."
    },
    "terms_required": {
      "title": "Terms not accepted",
      "message": "Agree to the terms to continue."
    },
    "license_owned": {
      "title": "License in another account",
      "message": "This {product} license is already in another Polaris Locker account. A license never moves by its key."
    },
    "license_email_bound": {
      "title": "Email not verified",
      "message": "This license belongs to an email address your Polaris Locker account hasn't verified. Verify that email in your account, then try again."
    },
    "account_required": {
      "title": "Sign-in needed",
      "message": "Sign in to your Polaris Locker account on this device, then try again."
    },
    "email_mismatch": {
      "title": "Email not verified",
      "message": "This license belongs to an email address your account hasn't verified. Add and verify that email, then try again."
    },
    "link_conflict": {
      "title": "Already linked",
      "message": "That sign-in method belongs to another Polaris Locker account. Sign in to that account, or join the two accounts."
    },
    "last_link": {
      "title": "Can't remove",
      "message": "This is your account's only sign-in method. Add another one before removing it."
    },
    "step_up_required": {
      "title": "Confirm it's you",